<?xml version="1.0" encoding="UTF-8"?>
<xs:schema xmlns:xs="http://www.w3.org/2001/XMLSchema">
	<xs:element name="Root">
		<xs:complexType>
			<xs:sequence>
				<xs:element ref="Customers" />
				<xs:element ref="Orders" />
			</xs:sequence>
		</xs:complexType>
	</xs:element>
	
	<xs:element name="Customers">
		<xs:complexType>
			<xs:sequence>
				<xs:element ref="Customer" maxOccurs="unbounded"/>
			</xs:sequence>
		</xs:complexType>
	</xs:element>
	
	<xs:element name="Orders">
		<xs:complexType>
			<xs:sequence>
				<xs:element ref="Order" maxOccurs="unbounded" />
			</xs:sequence>
		</xs:complexType>
	</xs:element>
	
	<xs:element name="Customer" type="CustomerType" />
	<xs:element name="Order" type="OrderType" />
	
	<xs:complexType name="CustomerType">
		<xs:sequence>
			<xs:element name="CompanyName" type="xs:string" />
			<xs:element name="ContactName" type="xs:string" />
			<xs:element name="ContactTitle" type="xs:string" />
			<xs:element name="Phone" type="xs:string" />
			<xs:element name="Fax" type="xs:string" minOccurs="0" />
			<xs:element name="FullAddress" type="AddressType" />
		</xs:sequence>
		<xs:attribute name="CustomerID" type="xs:string" /> 
	</xs:complexType>
	
	<xs:complexType name="AddressType">
		<xs:sequence>
			<xs:element name="Address" type="xs:string" />
			<xs:element name="City" type="xs:string" />
			<xs:element name="Province" type="xs:string" />
			<xs:element name="PostalCode" type="xs:string" />
			<xs:element name="Country" type="xs:string" />
		</xs:sequence>
	</xs:complexType>
	
	<xs:complexType name="OrderType" >
		<xs:sequence>
			<xs:element name="CustomerID" type="xs:string" />
			<xs:element name="EmployeeID" type="xs:string" />
			<xs:element name="OrderDate" type="xs:dateTime" />
			<xs:element name="RequiredDate" type="xs:dateTime" />
			<xs:element name="ShipInfo" type="ShipInfoType" />
		</xs:sequence>
	</xs:complexType>
	
	<xs:complexType name="ShipInfoType">
		<xs:sequence>
			<xs:element name="ShipVia" type="xs:integer" />
			<xs:element name="Freight" type="xs:decimal" />
			<xs:element name="ShipName" type="xs:string" />
			<xs:element name="ShipAddress" type="xs:string" />
			<xs:element name="ShipCity" type="xs:string" />
			<xs:element name="ShipProvince" type="xs:string" />
			<xs:element name="ShipPostalCode" type="xs:string" />
			<xs:element name="ShipCountry" type="xs:string" />
		</xs:sequence>
		<xs:attribute name="ShippedDate" type="xs:dateTime" />
	</xs:complexType>
	
</xs:schema>
